"Package","Item","Title","unique"
"vcd","Federalist","'May' in Federalist Papers","vcdFederalist"
"vcd","Hitters","Hitters Data","vcdHitters"
"vcd","HorseKicks","Death by Horse Kicks","vcdHorseKicks"
"vcd","Hospital","Hospital data","vcdHospital"
"vcd","JobSatisfaction","Job Satisfaction Data","vcdJobSatisfaction"
"vcd","JointSports","Opinions About Joint Sports","vcdJointSports"
"vcd","Lifeboats","Lifeboats on the Titanic","vcdLifeboats"
"vcd","NonResponse","Non-Response Survey Data","vcdNonResponse"
"vcd","OvaryCancer","Ovary Cancer Data","vcdOvaryCancer"
"vcd","PreSex","Pre-marital Sex and Divorce","vcdPreSex"
"vcd","Punishment","Corporal Punishment Data","vcdPunishment"
"vcd","RepVict","Repeat Victimization Data","vcdRepVict"
"vcd","Saxony","Families in Saxony","vcdSaxony"
"vcd","SexualFun","Sex is Fun","vcdSexualFun"
"vcd","SpaceShuttle","Space Shuttle O-ring Failures","vcdSpaceShuttle"
"vcd","Suicide","Suicide Rates in Germany","vcdSuicide"
"vcd","Trucks","Truck Accidents Data","vcdTrucks"
"vcd","UKSoccer","UK Soccer Scores","vcdUKSoccer"
"vcd","VisualAcuity","Visual Acuity in Left and Right Eyes","vcdVisualAcuity"
"vcd","VonBort","Von Bortkiewicz Horse Kicks Data","vcdVonBort"
"vcd","WeldonDice","Weldon's Dice Data","vcdWeldonDice"
"vcd","WomenQueue","Women in Queues","vcdWomenQueue"
"Zelig","MatchIt.url","Table of links for Zelig","ZeligMatchIt.url"
"Zelig","PErisk","Political Economic Risk Data from 62 Countries in 1987","ZeligPErisk"
"Zelig","SupremeCourt","U.S. Supreme Court Vote Matrix","ZeligSupremeCourt"
"Zelig","Weimar","1932 Weimar election data","ZeligWeimar"
"Zelig","Zelig.url","Table of links for Zelig","ZeligZelig.url"
"Zelig","approval","U.S. Presidential Approval Data","Zeligapproval"
"Zelig","bivariate","Sample data for bivariate probit regression","Zeligbivariate"
"Zelig","coalition","Coalition Dissolution in Parliamentary Democracies","Zeligcoalition"
"Zelig","coalition2","Coalition Dissolution in Parliamentary Democracies, Modified Version","Zeligcoalition2"
"Zelig","eidat","Simulation Data for Ecological Inference","Zeligeidat"
"Zelig","free1","Freedom of Speech Data","Zeligfree1"
"Zelig","free2","Freedom of Speech Data","Zeligfree2"
"Zelig","friendship","Simulated Example of Schoolchildren Friendship Network","Zeligfriendship"
"Zelig","grunfeld","Simulation Data for model Seemingly Unrelated Regression (sur) that corresponds to method SUR of systemfit","Zeliggrunfeld"
"Zelig","hoff","Social Security Expenditure Data","Zelighoff"
"Zelig","homerun","Sample Data on Home Runs Hit By Mark McGwire and Sammy Sosa in 1998.","Zelighomerun"
"Zelig","immi1","Individual Preferences Over Immigration Policy","Zeligimmi1"
"Zelig","immi2","Individual Preferences Over Immigration Policy","Zeligimmi2"
"Zelig","immi3","Individual Preferences Over Immigration Policy","Zeligimmi3"
"Zelig","immi4","Individual Preferences Over Immigration Policy","Zeligimmi4"
"Zelig","immi5","Individual Preferences Over Immigration Policy","Zeligimmi5"
"Zelig","immigration","Individual Preferences Over Immigration Policy","Zeligimmigration"
"Zelig","klein","Simulation Data for model Two-Stage Least Square (twosls) that corresponds to method 2SLS of systemfit","Zeligklein"
"Zelig","kmenta","Simulation Data for model Three-Stage Least Square (threesls) that corresponds to method 3SLS of systemfit","Zeligkmenta"
"Zelig","macro","Macroeconomic Data","Zeligmacro"
"Zelig","mexico","Voting Data from the 1988 Mexican Presidental Election","Zeligmexico"
"Zelig","mid","Militarized Interstate Disputes","Zeligmid"
"Zelig","newpainters","The Discretized Painter's Data of de Piles","Zelignewpainters"
"Zelig","sanction","Multilateral Economic Sanctions","Zeligsanction"
"Zelig","seatshare","Left Party Seat Share in 11 OECD Countries","Zeligseatshare"
"Zelig","sna.ex","Simulated Example of Social Network Data","Zeligsna.ex"
"Zelig","swiss","Swiss Fertility and Socioeconomic Indicators (1888) Data","Zeligswiss"
"Zelig","tobin","Tobin's Tobit Data","Zeligtobin"
"Zelig","turnout","Turnout Data Set from the National Election Survey","Zeligturnout"
"Zelig","voteincome","Sample Turnout and Demographic Data from the 2000 Current Population Survey","Zeligvoteincome"
